<?xml version="1.0" encoding="UTF-8"?>
<list xmlns:xsi="http://www.w3.org/2001/XMLSchema-instance" xsi:noNamespaceSchemaLocation="../xsd/multisell.xsd">
	<item>
		<!-- Adena -->
		<ingredient count="13200" id="57" />
		<!-- Transformation Scroll: Schuttgart Human Mercenary -->
		<production count="1" id="13665" />
	</item>
	<item>
		<!-- Adena -->
		<ingredient count="13200" id="57" />
		<!-- Transformation Scroll: Schuttgart Elf Mercenary -->
		<production count="1" id="13666" />
	</item>
	<item>
		<!-- Adena -->
		<ingredient count="13200" id="57" />
		<!-- Transformation Scroll: Schuttgart Dark Elf Mercenary -->
		<production count="1" id="13667" />
	</item>
	<item>
		<!-- Adena -->
		<ingredient count="13200" id="57" />
		<!-- Transformation Scroll: Schuttgart Orc Mercenary -->
		<production count="1" id="13668" />
	</item>
	<item>
		<!-- Adena -->
		<ingredient count="13200" id="57" />
		<!-- Transformation Scroll: Schuttgart Dwarf Mercenary -->
		<production count="1" id="13669" />
	</item>
	<item>
		<!-- Adena -->
		<ingredient count="13200" id="57" />
		<!-- Transformation Scroll: Schuttgart Kamael Mercenary -->
		<production count="1" id="13670" />
	</item>
	<item>
		<!-- Adena -->
		<ingredient count="70000" id="57" />
		<!-- Schuttgart Disguise Scroll -->
		<production count="1" id="13685" />
	</item>
</list>
